{
  "id": "YYYY-MM-DD-topic-slug",
  "title": "填写本期标题",
  "subtitle": "用一句话说明这次讨论最值得读的内容。",
  "date": "YYYY-MM-DD",
  "event_date": null,
  "source_type": "recording",
  "duration": "HH:MM:SS",
  "status": "draft",
  "reviewed_by": "",
  "tags": [],
  "summary": "填写本期导读。",
  "source_note": "仅发布已审核的整理内容；未获公开授权的原文与来源链接请留在本地。",
  "sources": [],
  "topics": [
    {
      "id": "topic-1",
      "category": "主题分类",
      "title": "用具体问题和判断写标题",
      "time_range": "00:00–05:00",
      "paragraphs": [
        "讨论从什么问题开始？",
        "参与者提出了哪些不同观点、经验与依据？",
        "最后达成了什么，哪些问题仍待验证？"
      ],
      "editor_note": "可选：编辑观察，必须与参与者观点区分。",
      "quotes": [],
      "links": []
    }
  ],
  "followups": []
}
